https://www.joebucsfan.com/2025/02/winning-with-jason-licht-the-turning-point-signing-part-i/|Winning With Jason Licht: The Turning Point Signing (Part I)|The NFL Scouting Combine kicks off tomorrow. The silly season of the offseason officially ramps up with team executives plotting, scheming, angling, misdirecting and investigating for the defining moves ahead. So Joe thinks this is a great time to roll out a multi-part series on Buccaneers Ring of Honor general manager Jason Licht. Joe’s talked to a lot of people about Licht with a focus on Licht’s defining moves that turned the Bucs into a Super Bowl champ and a lasting contender that’s since won four consecutive division titles. Joe asked new Raiders general manager John Spytek, the former Bucs assistant GM, to share what he thinks was the Bucs’ most critical free agent move of the Licht regime not named “Tom Brady.” Licht set out to assess well-known failures, overhaul the team mentality and step out of a norm, Spytek said. The result was a slightly surprising move on the offensive line in March of 2018. “No. 1, Ryan Jensen,” Spytek said with conviction. “When we were looking at what we wanted to get accomplished there — and it kind of like fit right with when we were really trying to organizationally and from a scouting standpoint trying to really self-assess, be really self-aware about why had failed. “The free agent signings, the draft picks, everyone was aware of the names that didn’t pan out. What were we missing? We were looking for somebody that was kind an enforcer. Somebody that had been through some sh*t in their life, but from a life standpoint and a football standpoint, and came from a great organization. Ryan Jensen fit that. “We made a decision there, that had not been something we typically do, dive in and pay the top of the market. We made him the highest paid center. And here’s a guy, ‘Is he a guard? Is he a center? What is he?’ “I think that was the start of kind of the re-branding of the Bucs and who we became, which was this hard-nosed tough, we’re-not-going-to-take-sh*t-from-anybody signing. “I thought without a doubt, while he was here and he was healthy, he was the best center in the NFL.” Spytek went on to say being the highest paid center meant something to Jensen and it wasn’t about the giant paycheck. Jensen was the right guy from the neck up. He was driven by that confidence shown by Licht, and by fulfilling what Licht and the staff wanted from him. Tomorrow, Joe will dive into another “re-branding” move by Licht, one born from an in-house method at One Buc Palace and unique foresight.|2025-02-24 20:17:00|432|19|7|Jason Licht|Licht's critical free agent move re-branded the Bucs successfully.|8|Mostly positive comments with praise for Jensen, Licht, and the team's recent improvements.|"{""commenter0"": {""username"": ""Ryan"", ""post"": ""Good post.  I\u2019m looking forward to the next one."", ""post_time"": [""February"", ""24th,"", ""2025"", ""at"", ""8:26"", ""pm""]}, ""commenter1"": {""username"": ""Defense Rules"", ""post"": ""Interesting choice by Spytek, but I can see why.  Ryan came to us in 2018 and we struggled offensively & defensively \u2026 to a 5-11 record.  We had a decent nucleus of an OLine (Jensen, Marpet, D Smith), but also had some weaknesses (Benenoch, Dotson).  2018 was also the year we traded for JPP, and he made a difference on the defensive side (12.5 sacks).  "", ""post_time"": [""February"", ""24th,"", ""2025"", ""at"", ""8:38"", ""pm""]}, ""commenter2"": {""username"": ""TB_MikeB"", ""post"": ""Interesting. I clicked this link assuming Shaq or Tommy was the answer. Jensen was great during his time here."", ""post_time"": [""February"", ""24th,"", ""2025"", ""at"", ""8:38"", ""pm""]}, ""commenter3"": {""username"": ""buc4evr"", ""post"": ""So tomorrow is the start of the illegal tampering period.  Hope the Bucs are working with agents on a few deals for edge rushers\u2026."", ""post_time"": [""February"", ""24th,"", ""2025"", ""at"", ""8:41"", ""pm""]}, ""commenter4"": {""username"": ""Saskbucs"", ""post"": ""This tracks. Jensen was the first domino in getting tougher in the trenches on the offensive side, finished off by the Wirfs steal pre SB."", ""post_time"": [""February"", ""24th,"", ""2025"", ""at"", ""9:05"", ""pm""]}, ""commenter5"": {""username"": ""Bring back the lawn chairs"", ""post"": ""Licht is the best gm this team has seen, but to be totally honest he did trade the rights of Josh Allen to buffalo for vita vea and draft picks. Which can be debated but I\u2019ll save it because some might say I\u2019m splitting hairs. We do luv our big teddy bear nose tackle."", ""post_time"": [""February"", ""24th,"", ""2025"", ""at"", ""9:40"", ""pm""]}, ""commenter6"": {""username"": ""BrianBucs"", ""post"": ""Good post Joe. This goes back to a reply I put on one of your posts last week. The Bucs need some attitude and aggressiveness and nastiness on defense. That is why they should get someone like a Maxx Crosby or Garrett or somebody like that. That is what the Bucs got with Suh and JPP. Bucs have a lot of good players on defense but nobody that is an enforcer or somebody that leads with fear factor. That is the kind of free agents the Bucs hopefully sign this offseason"", ""post_time"": [""February"", ""24th,"", ""2025"", ""at"", ""9:50"", ""pm""]}, ""commenter7"": {""username"": ""Defense Rules"", ""post"": ""BTW Joe, what we pulled off in 2019 set the tone for our defensive improvement (Suh, Shaq, Vea, D White, Dean, SMB, Edwards, etc) just like 2020 set the tone for our offensive improvement (Brady, Gronk, Wirfs, Fournette, Brown, etc).  "", ""post_time"": [""February"", ""24th,"", ""2025"", ""at"", ""10:19"", ""pm""]}, ""commenter8"": {""username"": ""Baking with Grizz"", ""post"": ""Great post Joe!"", ""post_time"": [""February"", ""24th,"", ""2025"", ""at"", ""10:25"", ""pm""]}, ""commenter9"": {""username"": ""OR Buc"", ""post"": ""Buc4evr"", ""post_time"": [""February"", ""24th,"", ""2025"", ""at"", ""11:23"", ""pm""]}, ""commenter10"": {""username"": ""Aqualung"", ""post"": ""Leave it to beaver to read this and find a critique of the guy Spytek (who might know a little) named as the turning point hire. SMH.  "", ""post_time"": [""February"", ""24th,"", ""2025"", ""at"", ""11:36"", ""pm""]}, ""commenter11"": {""username"": ""Aqualung"", ""post"": ""So, Jensen was the first domino.  I have a list of potential 2nd through 78th moves ready to cut and paste, can\u2019t wait for part II."", ""post_time"": [""February"", ""25th,"", ""2025"", ""at"", ""12:04"", ""am""]}, ""commenter12"": {""username"": ""T."", ""post"": ""Good read. Thank u."", ""post_time"": [""February"", ""25th,"", ""2025"", ""at"", ""12:11"", ""am""]}, ""commenter13"": {""username"": ""Red86"", ""post"": ""We\u2019re blessed to have Jason and crew. Definitely the best gm of this franchise."", ""post_time"": [""February"", ""25th,"", ""2025"", ""at"", ""5:22"", ""am""]}, ""commenter14"": {""username"": ""BuckyBuc"", ""post"": ""We miss Jensen badly, We need a enforcer like that on both sides of the ball. I will always look at Logan Hall as the guy that took Jensen out and made him retire."", ""post_time"": [""February"", ""25th,"", ""2025"", ""at"", ""7:31"", ""am""]}, ""commenter15"": {""username"": ""heyjude"", ""post"": ""Great post, Joe! Liked Jensen. Too bad he had gotten hurt."", ""post_time"": [""February"", ""25th,"", ""2025"", ""at"", ""8:07"", ""am""]}, ""commenter16"": {""username"": ""toopanca"", ""post"": ""I think that Jihaad Campbell could be the guy to do for the defense what Jensen did for the offense (like JPP and Suh in the past."", ""post_time"": [""February"", ""25th,"", ""2025"", ""at"", ""9:37"", ""am""]}, ""commenter17"": {""username"": ""SlyPirate"", ""post"": ""NICE ARTICLE \u2026"", ""post_time"": [""February"", ""25th,"", ""2025"", ""at"", ""10:22"", ""am""]}, ""commenter18"": {""username"": ""TexasBuc 1776"", ""post"": ""Loved Big Red, he brought it every play, every game."", ""post_time"": [""February"", ""25th,"", ""2025"", ""at"", ""12:27"", ""pm""]}}"
https://www.joebucsfan.com/2025/02/make-the-call-107/|Make The Call!||2025-02-24 12:48:00|0|21|5|Decision-making|Importance of making decisive choices in life.|4|Mixed sentiments with a slight leaning towards cautiousness and dissatisfaction.|"{""commenter0"": {""username"": ""ReeeBarrr"", ""post"": ""I voted LVD. That\u2019s the most barren position from my perspective"", ""post_time"": [""February"", ""24th,"", ""2025"", ""at"", ""11:26"", ""am""]}, ""commenter1"": {""username"": ""Tim"", ""post"": ""Although I\u2019d like to see the Bucs take Mike Green or Donald Ezeiruaku, I\u2019d be happy if we could get Jihaad Campbell. Dude can play the middle and roll out to edge."", ""post_time"": [""February"", ""24th,"", ""2025"", ""at"", ""11:28"", ""am""]}, ""commenter2"": {""username"": ""Lol"", ""post"": ""CG14, LVD54, then a new Edge Rusher. Priority is to keep the confirmed ballers we already have, then go out and look for the new blood"", ""post_time"": [""February"", ""24th,"", ""2025"", ""at"", ""11:30"", ""am""]}, ""commenter3"": {""username"": ""Josh"", ""post"": ""Chris Godwin has a cap hit of $18.5 million this year on or off the team. In order to make significant moves, he needs to be re-signed, and his contract needs to be restructured into a longer-term deal, spreading the money over multiple years."", ""post_time"": [""February"", ""24th,"", ""2025"", ""at"", ""11:32"", ""am""]}, ""commenter4"": {""username"": ""First Name Greatest"", ""post"": ""Can\u2019t keep doing the same thing on defense and expect different results"", ""post_time"": [""February"", ""24th,"", ""2025"", ""at"", ""11:38"", ""am""]}, ""commenter5"": {""username"": ""Kenton Smith"", ""post"": ""Well edge rusher has more than 50 percent. I don\u2019t know how you did it Joe but you set this poll up masterfully!"", ""post_time"": [""February"", ""24th,"", ""2025"", ""at"", ""11:45"", ""am""]}, ""commenter6"": {""username"": ""Aqualung"", ""post"": ""I vote for a young, aggressive, smart, full-time defensive coordinator."", ""post_time"": [""February"", ""24th,"", ""2025"", ""at"", ""11:57"", ""am""]}, ""commenter7"": {""username"": ""Krewe Since Birth"", ""post"": ""There\u2019s what I want and then there\u2019s what I think needs to happen."", ""post_time"": [""February"", ""24th,"", ""2025"", ""at"", ""12:23"", ""pm""]}, ""commenter8"": {""username"": ""Marine Buc"", ""post"": ""That\u2019s a tough one Joe\u2026"", ""post_time"": [""February"", ""24th,"", ""2025"", ""at"", ""12:44"", ""pm""]}, ""commenter9"": {""username"": ""Tbbucs3"", ""post"": ""Lavonte is great, But we\u2019ve also seen him be the best player on a lot of bad defenses, The priority needs to be somebody who can attack the quarterback consistently"", ""post_time"": [""February"", ""24th,"", ""2025"", ""at"", ""1:24"", ""pm""]}, ""commenter10"": {""username"": ""buc4evr"", ""post"": ""I trust that the Joes have been talking all season to the Bucs heirarchy about making a big splash in free agency with an Edge rusher or two.  Bucs need a veteran guy like Garrett that can make an immediate impact with no learning curve.  They can draft an ILB to replace LVD after next season.  The window is closing and the Bucs need to make the upcoming season count."", ""post_time"": [""February"", ""24th,"", ""2025"", ""at"", ""1:51"", ""pm""]}, ""commenter11"": {""username"": ""Fred McNeil"", ""post"": ""I would have said inside linebacker."", ""post_time"": [""February"", ""24th,"", ""2025"", ""at"", ""3:14"", ""pm""]}, ""commenter12"": {""username"": ""SlyPirate"", ""post"": ""I don\u2019t care if they resign Godwin. He\u2019s been a great Buc but the team has done well without him. I get the $18M cap hit as a motivator to resign him but only if the price is right. If he\u2019s back, great. If he\u2019s not, fine."", ""post_time"": [""February"", ""24th,"", ""2025"", ""at"", ""4:47"", ""pm""]}, ""commenter13"": {""username"": ""Anyhony"", ""post"": ""With Godwin the offense is a complete unit, one side of the ball not to worry about."", ""post_time"": [""February"", ""24th,"", ""2025"", ""at"", ""4:59"", ""pm""]}, ""commenter14"": {""username"": ""ModHairKen"", ""post"": ""Godwin. Godwin. Godwin. When you have someone like him, a great WR who is a humble man and not a prima donna, you do not let him leave. "", ""post_time"": [""February"", ""24th,"", ""2025"", ""at"", ""5:23"", ""pm""]}, ""commenter15"": {""username"": ""JimBobBuc"", ""post"": ""The home and away schedule is out for 2025. Two west coast games vs the Rams and Seahawks.  Away at Buffalo too!   Bucs got hit hard!"", ""post_time"": [""February"", ""24th,"", ""2025"", ""at"", ""5:27"", ""pm""]}, ""commenter16"": {""username"": ""Pickgrin"", ""post"": ""1st priority \u2013 Re-sign Chris Godwin and LD54 if he plays this year."", ""post_time"": [""February"", ""24th,"", ""2025"", ""at"", ""6:00"", ""pm""]}, ""commenter17"": {""username"": ""Mike Johnson"", ""post"": ""Please Bucs..I beg you..Don\u2019t do your usual Dumpster Diving for a DE. Get us a proven sack leader on that Defensive line other than Vita. Go after a guy like Garrett."", ""post_time"": [""Mike"", ""Johnson""]}, ""commenter18"": {""username"": ""Curse of Gruden"", ""post"": ""Punter shouldn\u2019t be on this list. Licht will draft a punter, hopefully not in the 2nd round."", ""post_time"": [""February"", ""24th,"", ""2025"", ""at"", ""7:51"", ""pm""]}, ""commenter19"": {""username"": ""Marine Buc"", ""post"": ""@ Pick"", ""post_time"": [""February"", ""24th,"", ""2025"", ""at"", ""9:32"", ""pm""]}, ""commenter20"": {""username"": ""Marine Buc"", ""post"": ""@ M. Johnson"", ""post_time"": [""February"", ""24th,"", ""2025"", ""at"", ""9:34"", ""pm""]}}"
https://www.joebucsfan.com/2025/02/best-in-class-ranks-the-top-5-2024-draft-classes-on-performance/|Best In Class Ranks The Top-5 2024 Draft Classes On Performance|  It’s the annual top-5 draft rankings by JoeBucsFan.com draft guru Sean Sullivan! Yes, the Bucs make an appearance. Enjoy! Listen by clicking above. Or enjoy at Apple Podcasts and other platforms. All the fun is presented by Bill Currie Ford, where summer savings are fantastic. Sean also is the eager Bill Currie Ford GM ready to help you personally with all of your automotive needs. Fire off questions on football and more to Sean at BestInClass@BillCurrie.com.|2025-02-24 12:46:00|76|0|5|Best In Class|Annual draft class rankings; Bucs featured.||No comments available.|{}
https://www.joebucsfan.com/2025/02/get-the-facts/|Get The Facts|Dr. James DeRespino and Center For Men’s Health have long supported JoeBucsFan.com. Thanks, Dr. Jim! With so many offices across the Tampa Bay area, Center For Men’s Health makes getting quality care easy. Please visit C4MH.com today. Their website is loaded with great information and all the details.|2025-02-24 11:10:00|48|0|7|Dr. James DeRespino|Center For Men's Health sponsorship appreciation.||No comments available.|{}
