https://www.joebucsfan.com/2024/11/yall-got-to-keep-sheps-head-clear/|“Y’all Got To Keep Shep’s Head Clear”|So who is the Bucs’ leader in dumb penalties this season? It’s the same guy who insiders at One Buc Palace often say leads the team in energy and intensity.  Veteran receiver Sterling Shepard has been a wild card this season. He’s done a good job taking handoffs and making big catches in limited time — 28 touches in 9 games. Coaches and players have praised him for being a constant energizer, uplifting teammates with boundless spirit and passion. Shepard was like that during his eight years with Giants, but this year, his first in Tampa, has come with four penalties, a huge number for his position. “Shep” has one each for unnecessary roughness, pass interference, unsportsmanlike conduct and illegal motion. Buccaneers running back Rachaad White joined SiriusXM NFL Radio this week and noted that players have been told to keep Shep’s mind right. “He plays furious and he plays ferocious, man,” White said of Shepard. “And you love a guy like that, and it gets to the point where coaches when we get to gameday be like, ‘Y’all got to keep Shep’s head clear. You all got to keep him calm’ and things like that. But no. That’s not how you play football. It’s a violent game. “It’s a crazy game. You got to be crazy to play this game. That’s just the reality of it, or have some craziness in you. So, Shep got all of that and he bring that juice, that energy, man. He’s still a great route runner. He’ll still catch that ball.” Joe enjoyed White saying that he wants no part of calming Shepard down. However, Joe thinks somebody should. Joe thought the bad penalites were behind Shepard, but he had a senseless illegal motion penalty against the Giants on Sunday that wiped out a Bucs gain. Regardless, Shepard has been a huge plus for the Bucs. And if he can stay healthy, an issue in his career, he could represent a quality postseason target for Baker Mayfield. Ira Kaufman Talks Lineup Change, Baker Mayfield, Realities And Illusions From The Giants Game & Shaq Barrett; Plus Ira Lectures Cynical Bucs Fans, And More |2024-11-27 18:02:00|359|17|6|Sterling Shepard|Shepard provides energy but struggles with penalties in Buccaneers.|4|Mixed sentiments with critical remarks on individual players and some positivity.|"{""commenter0"": {""username"": ""Buccaneer Bonzai"", ""post"": ""Sterling Shepard is not worthy of a roster spot. Just look at his dropped passes."", ""post_time"": [""November"", ""27th,"", ""2024"", ""at"", ""6:28"", ""pm""]}, ""commenter1"": {""username"": ""Buddha"", ""post"": ""Betting with Buddha  Season Record:  23-21-0"", ""post_time"": [""November"", ""27th,"", ""2024"", ""at"", ""6:45"", ""pm""]}, ""commenter2"": {""username"": ""Joseph C Simmons"", ""post"": ""He\u2019s been decent, but I really wish J-Mac would establish himself as the #2 receiver after Evans (and pending any possibility of a Godwin return this year)."", ""post_time"": [""Joseph"", ""C"", ""Simmons""]}, ""commenter3"": {""username"": ""Bakerfan"", ""post"": ""2 maybe 3 of those penalties were complete BS."", ""post_time"": [""November"", ""27th,"", ""2024"", ""at"", ""8:29"", ""pm""]}, ""commenter4"": {""username"": ""GoneGator"", ""post"": ""Ryan Miller is a sleeper. He\u2019s lost a couple but he attacks the ball and he, and Jarret just seem to be more physical than J-Mac and Palmer. "", ""post_time"": [""November"", ""27th,"", ""2024"", ""at"", ""8:55"", ""pm""]}, ""commenter5"": {""username"": ""Dave Pear"", ""post"": ""Hmm. Interesting."", ""post_time"": [""November"", ""27th,"", ""2024"", ""at"", ""9:20"", ""pm""]}, ""commenter6"": {""username"": ""garro"", ""post"": ""Keeping his head in the game and avoiding being stupid would go a long way. Otherwise play Ryan Miller."", ""post_time"": [""November"", ""28th,"", ""2024"", ""at"", ""12:16"", ""am""]}, ""commenter7"": {""username"": ""Buc4evr"", ""post"": ""Miller has been better than McMillian.  And Palmer is hit or miss.  I don\u2019t know what to think of Shepard. The guy flashes, but then does stupid stuff at the wrong time."", ""post_time"": [""November"", ""28th,"", ""2024"", ""at"", ""12:43"", ""am""]}, ""commenter8"": {""username"": ""Dave Pear"", ""post"": ""All the players are great! Hobbits."", ""post_time"": [""November"", ""28th,"", ""2024"", ""at"", ""1:19"", ""am""]}, ""commenter9"": {""username"": ""mj"", ""post"": ""funny how suddenly all the scrubs seem 30% better with 13 on the field, it\u2019s like the opposing defense is playing with one less person now"", ""post_time"": [""November"", ""28th,"", ""2024"", ""at"", ""4:38"", ""am""]}, ""commenter10"": {""username"": ""adam from ny"", ""post"": ""i think shep had the most 2 & 3 yard catches in the history of the nfl last sunday\u2026\u2026\u2026\u2026lol\u2026"", ""post_time"": [""November"", ""28th,"", ""2024"", ""at"", ""6:58"", ""am""]}, ""commenter11"": {""username"": ""adam from ny"", ""post"": ""yeah they don\u2019t use durham enough\u2026he\u2019s good for a surprise big play more often\u2026reliable hands too\u2026"", ""post_time"": [""November"", ""28th,"", ""2024"", ""at"", ""7:01"", ""am""]}, ""commenter12"": {""username"": ""adam from ny"", ""post"": ""most hyped up dude in preseason was mcmillan\u2026"", ""post_time"": [""November"", ""28th,"", ""2024"", ""at"", ""7:11"", ""am""]}, ""commenter13"": {""username"": ""Jeffrey Becker"", ""post"": ""the vig\u2019s killin ya budha..  gotta win 60 pct or more.    on 100 per bet, ur net minus ten bucks \ud83d\ude42      good times"", ""post_time"": [""November"", ""28th,"", ""2024"", ""at"", ""7:14"", ""am""]}, ""commenter14"": {""username"": ""dmatt"", ""post"": ""One would think that TPalmer would\u2019ve stepped up but he\u2019s borderline average at best. He\u2019s another \u201clet me fair catch or run outta bounds Jayden Darden\u201d. Now I u destined his reason for transferring from lsu to Nebraska. He didn\u2019t possess what the two game changers  Jamal Chase n Justin Simmons have. Why do we continue to draft passive, no heart, no aggressive players i.e., TPalmer, JDean, JTS, OJHoward, n Jaden Darden. Our receivers need to step up down the stretch. JMcMillan seems to be one n done (first game of season) TPalmer is a bust,Ryan Miller is suspect, Rahim Jarrett is suspect."", ""post_time"": [""November"", ""28th,"", ""2024"", ""at"", ""7:58"", ""am""]}, ""commenter15"": {""username"": ""unbelievable"", ""post"": ""2 of those 4 penalties were absolute nonsense, and you and everyone watching knows it. Even the announcers thought they were total BS. "", ""post_time"": [""November"", ""29th,"", ""2024"", ""at"", ""4:17"", ""pm""]}, ""commenter16"": {""username"": ""unbelievable"", ""post"": ""@dmatt \u2013 Ryan Miller and Rakim Jarret were both undrafted free agents, not draft picks. "", ""post_time"": [""November"", ""29th,"", ""2024"", ""at"", ""4:20"", ""pm""]}}"
https://www.joebucsfan.com/2024/11/the-nightmare-before-christmas/|The Nightmare Before Christmas|Todd sees 54 entries left in the $14M Circa Survivor contest in Las Vegas. Todd also sees a combined 54 entries that still have the Lions and Chiefs available. Considering how double digit favorites have failed often in 2024, Todd discusses the nightmare scenario if one or both the Lions and Chiefs lose this week. The Todd Wright Survivor Football Podcast is presented by Brandon Legal Group. The Todd Wright Survivor Football Podcast is also found on iHeart Radio. Click above to listen or download.|2024-11-27 18:00:00|85|0|4|Todd Wright|Vegas contest dilemma with potential nightmare scenario.||No comments available.|{}
https://www.joebucsfan.com/2024/11/calijah-kanceys-one-of-a-kind-trait/|Calijah Kancey’s One-Of-A-Kind Trait|Is Bucs defensive tackle Calijah Kancey the best defensive tackle in the NFL? No, he’s not, but he’s certainly among the most unique, and among the most productive on a per-game basis. After another preseason calf issue cost Kancey the entire preseason and five regular season games, the Bucs’ second-year beast now has five sacks in six games. Perhaps more important, he’s flashed rare skill and racked up a bunch of other numbers. Todd Bowles says Kancey is one-of-a-kind on his defensive line. “He’s the only one up front that can get off a block and then explode from A to B right now,” Bowles told the Buccaneers Radio Network. “I mean, his closing speed on the quarterback is faster than what the quarterback thinks it is. And he can get there right now and it kind of surprises quarterbacks because he’s so quick getting back there. “He’s still tapping his potential. And he can see what he can do right now, and it’s a scary thought.” The sadsack Panthers, Sunday’s opponent, have played a few centers this season and made changes along their offensive line. The Carolina O-line may be the team’s strength, but that doesn’t raise it to the level of “good.” Joe sees the Bucs’ remaining schedule and thinks Kancey can challenge for double-digit sacks this season.|2024-11-27 15:45:00|220|28|8|Calijah Kancey|Unique and productive defensive tackle with high potential.|9|Optimistic outlook on players and team performance with some playful banter and sarcasm present.|"{""commenter0"": {""username"": ""Larrd"", ""post"": ""Kancey is definitely a 10 sack DT if he can ever play all the games. Big Vita has been good, too. Two firsts for Micah Parsons and the Bucs pass rush would be ferocious."", ""post_time"": [""November"", ""27th,"", ""2024"", ""at"", ""3:52"", ""pm""]}, ""commenter1"": {""username"": ""ATLBUC"", ""post"": ""Now that\u2019s a thought! \ud83e\udd14 But I think JPP was the last in season trade."", ""post_time"": [""November"", ""27th,"", ""2024"", ""at"", ""4:00"", ""pm""]}, ""commenter2"": {""username"": ""Kenton Smith"", ""post"": ""Wondered when we were gonna start giving this guy his due. Joe great question to open. Bowles says\u201dhis closing speed on the quarterback is faster than what the quarterback thinks it is \u201c. Ain\u2019t that the truth! \u201cHe\u2019s still tapping his potential\u2026and it\u2019s a scary thought \u201c. Todd Bowles that\u2019s funnier than hell!  I\u2019m laughing right now \u201cHe\u2019s the only one up front that can get off a block and then explode from A to B right now \u201c. This is hilarious!! And Vita is right next to him! Stop it!! My sides are killing me!!"", ""post_time"": [""November"", ""27th,"", ""2024"", ""at"", ""4:09"", ""pm""]}, ""commenter3"": {""username"": ""A Bucs Fan"", ""post"": ""@ATLBUC \u2013 JPP was acquired in March. The last in-season trade was Grant Stuard to the Colts. Before that it was Jonathan Banks and Jonathan Casillias years ago."", ""post_time"": [""November"", ""27th,"", ""2024"", ""at"", ""4:18"", ""pm""]}, ""commenter4"": {""username"": ""A Bucs Fan"", ""post"": ""Kancey is a 15-20 sack DT if he ever stays healthy. He\u2019ll finish over 10 this season if he remains healthy."", ""post_time"": [""November"", ""27th,"", ""2024"", ""at"", ""4:20"", ""pm""]}, ""commenter5"": {""username"": ""Jeff"", ""post"": ""Carolina 17 Bucs 13.  Baker has a pick six."", ""post_time"": [""November"", ""27th,"", ""2024"", ""at"", ""4:40"", ""pm""]}, ""commenter6"": {""username"": ""A Bucs Fan"", ""post"": ""Carolina has give up over 1700 yards on the ground and 17 TD\u2019s. Bucs could run for 200 yards and 4 TD\u2019s."", ""post_time"": [""November"", ""27th,"", ""2024"", ""at"", ""4:44"", ""pm""]}, ""commenter7"": {""username"": ""A Bucs Fan"", ""post"": ""@Joe Bucky is ranked 5th in the entire NFL in yards per touch (min 100 attempts). Right behind Saquon Barkley himself."", ""post_time"": [""November"", ""27th,"", ""2024"", ""at"", ""5:13"", ""pm""]}, ""commenter8"": {""username"": ""#99 the big fella"", ""post"": ""Jeff , we don\u2019t need fans like you..take a hike"", ""post_time"": [""November"", ""27th,"", ""2024"", ""at"", ""5:29"", ""pm""]}, ""commenter9"": {""username"": ""Usfbuc"", ""post"": ""The Bucs aren\u2019t losing to the Panthers. I predict a big outing by the offense. ME is going to be more involved this week. I think he pulls in two TDs and 150 yards. Run game is going to roll too, I am calling 200+ yards rushing. Bucs will jump out to an early lead forcing the Panthers to pass in the second half and we will get 4 sacks bc of the number of drop backs."", ""post_time"": [""November"", ""27th,"", ""2024"", ""at"", ""5:39"", ""pm""]}, ""commenter10"": {""username"": ""Tony"", ""post"": ""I wanted Kancey coming out, too! I always had a feeling he could be good."", ""post_time"": [""November"", ""27th,"", ""2024"", ""at"", ""5:44"", ""pm""]}, ""commenter11"": {""username"": ""Woodenman"", ""post"": ""Just bet the opposite  of  what ever Jeff says you win every time."", ""post_time"": [""November"", ""27th,"", ""2024"", ""at"", ""5:46"", ""pm""]}, ""commenter12"": {""username"": ""GoneGator"", ""post"": ""He might break Bryce Young in 2 if he hits him like he did Devito \ud83e\udd23"", ""post_time"": [""November"", ""27th,"", ""2024"", ""at"", ""5:53"", ""pm""]}, ""commenter13"": {""username"": ""Tony"", ""post"": ""@Jeff"", ""post_time"": [""November"", ""27th,"", ""2024"", ""at"", ""6:33"", ""pm""]}, ""commenter14"": {""username"": ""Bojim"", ""post"": ""Hes getting scary good."", ""post_time"": [""November"", ""27th,"", ""2024"", ""at"", ""6:43"", ""pm""]}, ""commenter15"": {""username"": ""Beeej"", ""post"": ""Has Baker thrown a pick-6 since he\u2019s BEEN here?"", ""post_time"": [""November"", ""27th,"", ""2024"", ""at"", ""6:48"", ""pm""]}, ""commenter16"": {""username"": ""B"", ""post"": ""Maybe we put him on the edge? Then drop him back in pass protection\u2026oh wait, nevermind."", ""post_time"": [""November"", ""27th,"", ""2024"", ""at"", ""9:44"", ""pm""]}, ""commenter17"": {""username"": ""Buc1987"", ""post"": ""Jeff loses all by himself."", ""post_time"": [""November"", ""27th,"", ""2024"", ""at"", ""10:48"", ""pm""]}, ""commenter18"": {""username"": ""firethecannons"", ""post"": ""Hope this is not a trap game, look forward to watching Kancey, hope he stays healthy rest of the year."", ""post_time"": [""November"", ""27th,"", ""2024"", ""at"", ""11:39"", ""pm""]}, ""commenter19"": {""username"": ""Dave Pear"", ""post"": ""Wow. Good point."", ""post_time"": [""November"", ""28th,"", ""2024"", ""at"", ""12:05"", ""am""]}, ""commenter20"": {""username"": ""garro"", ""post"": ""Bowles aint kidding. I was thinking a couple of times lately that he looks quicker to the QB than I remember Sapp being. Although I\u2019m sure Warren would disagree. LOL"", ""post_time"": [""November"", ""28th,"", ""2024"", ""at"", ""12:26"", ""am""]}, ""commenter21"": {""username"": ""Vanessa Anne"", ""post"": ""It really has been amazing to watch what Calijah and Vita can do these past few games. "", ""post_time"": [""November"", ""28th,"", ""2024"", ""at"", ""5:03"", ""am""]}, ""commenter22"": {""username"": ""Jeffrey Becker"", ""post"": ""my favorite buccaneer easy.  hoping he trades some calf work for yoga though.   all athletes benefit from increased range of motion, and you won\u2019t get hurt doing it.  take 20 pct of the weight room work and turn it into yoga.  injuries will likely be less frequent.   no idea what we do so horribly wrong that guarantees we always have critical injury issues, but weights is a good place to start looking for answers"", ""post_time"": [""November"", ""28th,"", ""2024"", ""at"", ""7:18"", ""am""]}, ""commenter23"": {""username"": ""Glass Half Full Guy"", ""post"": ""Bucs pass rush isn\u2019t an issue. We have guys like Kancey, VV, Nelson, etc that can get to the QB. The problem is we get torched on quick passes because the DBs give up too much cushion off the line in Bowles\u2019 zone scheme, especially over the middle. You\u2019d have to have a guy in the QB\u2019s grille in under 2 seconds to prevent that. Tighten up the coverage off the line to take away the quick passes and your sacks will increase. That\u2019s why rookie QBs torch us. Their OCs don\u2019t ask the rookies to do much more than dink and dunk for the most part and our loose coverage allows for it to work."", ""post_time"": [""November"", ""28th,"", ""2024"", ""at"", ""8:42"", ""am""]}, ""commenter24"": {""username"": ""Lou."", ""post"": ""Don\u2019t remember \u201cetc.\u201d making any impact at all."", ""post_time"": [""November"", ""28th,"", ""2024"", ""at"", ""8:54"", ""am""]}, ""commenter25"": {""username"": ""Glass Half Full Guy"", ""post"": ""@Lou \u2026 etc was a walk-on, undrafted free agent, so he goes largely unnoticed. \ud83d\ude09 Happy Thanksgiving!"", ""post_time"": [""November"", ""28th,"", ""2024"", ""at"", ""9:59"", ""am""]}, ""commenter26"": {""username"": ""Cobraboy"", ""post"": ""Kamcey\u2019s kryptonite is he\u2019s proven so far to be injury-prone."", ""post_time"": [""November"", ""28th,"", ""2024"", ""at"", ""10:43"", ""am""]}, ""commenter27"": {""username"": ""orlbucfan"", ""post"": ""Hope Kancey stays healthy and finishes the season. Any update on SVD?"", ""post_time"": [""November"", ""28th,"", ""2024"", ""at"", ""6:46"", ""pm""]}}"
https://www.joebucsfan.com/2024/11/mike-evans-impact-on-offense-huge/|Mike Evans’ Impact On Offense “Huge”|If you thought the Bucs offense looked different Sunday against the Giants than in recent games, you are not alone. Joe thought the same. A big reason was future Hall of Fame receiver Mike Evans returned to the field, despite being/not being 100 percent, depending on who is talking. The offense just looked sharper, at least in the passing game. You could tell the Giants very much were paying attention to Evans. And that seemed to open up things for everyone. So today, Joe asked Bucs offensive Liam Coen what sort of impact Evans’ return brought after missing three games with a bum hamstring, suffered in the loss to Baltimore. “Huge, huge!” Coen said. “Just his presence alone, what it does, what you can at times dictate in terms of what kind of defensive structure you’re going to get.” It wasn’t just the X’s and O’s element where Evans made an impact, Coen said. Evans’ confidence, he said, is contagious. “The players draw confidence” [from Evans], Coen added. An area of the field Coen had planned to attack against the Giants just so happens to be an area where Evans shines. “His ability to go win one-on-one routes and give us some plays down the field — more so in that intermediate range where we were trying to get into this past week,” Coen said. Evans is “such a good dude. It’s always good to have him back.” The way the offense was so sharp with Evans back gave Joe hope that running the table in the final six weeks isn’t as crazy as Joe previously believed. Evans is good enough to carry an offense — so long as he has a healthy hamstring.|2024-11-27 13:42:00|284|16|9|Mike Evans|Mike Evans' return greatly impacts Bucs' offense for the better.|3|Mixed sentiments with some optimism but doubts about players carrying the team.|"{""commenter0"": {""username"": ""DavidBigBucsFan99"", ""post"": ""Yet we had him and Godwin and did nada against the Broncos. Luckily now the o line is jelling and Coen is able to expand his play book. If only he\u2019d give Irving 20 totes a game"", ""post_time"": [""November"", ""27th,"", ""2024"", ""at"", ""1:50"", ""pm""]}, ""commenter1"": {""username"": ""A Bucs Fan"", ""post"": ""I\u2019m just waiting for that 200 yard 3 TD game coming soon."", ""post_time"": [""November"", ""27th,"", ""2024"", ""at"", ""2:12"", ""pm""]}, ""commenter2"": {""username"": ""BakerFan"", ""post"": ""Catch the ball Mike and you might be able to get the 1000 yard season.  Rooting for you."", ""post_time"": [""November"", ""27th,"", ""2024"", ""at"", ""2:17"", ""pm""]}, ""commenter3"": {""username"": ""GoneGator"", ""post"": ""I\u2019d only disagree with the assertion that ME can \u201ccarry an offense\u201d. "", ""post_time"": [""November"", ""27th,"", ""2024"", ""at"", ""3:19"", ""pm""]}, ""commenter4"": {""username"": ""Mike C"", ""post"": ""You mean\u2026.. you don\u2019t just line up and \u201cdo what we do\u201d?"", ""post_time"": [""November"", ""27th,"", ""2024"", ""at"", ""3:42"", ""pm""]}, ""commenter5"": {""username"": ""Kenton Smith"", ""post"": ""Reread what Liam says about \u201ccontagious confidence\u201d. We threw for 230 yards in the first half. Evans value can\u2019t be overstated. But GoneGator isn\u2019t gonna carry a team anymore. Good news is that he doesn\u2019t have to."", ""post_time"": [""November"", ""27th,"", ""2024"", ""at"", ""4:22"", ""pm""]}, ""commenter6"": {""username"": ""Kenton Smith"", ""post"": ""Sorry GoneGator- Mike Evans isn\u2019t gonna carry a team anymore."", ""post_time"": [""November"", ""27th,"", ""2024"", ""at"", ""4:24"", ""pm""]}, ""commenter7"": {""username"": ""Marky Mark"", ""post"": ""Ravens, Chiefs, Niners, Atlanta 1,2, were all very winnable. Only Denver was a blowout loss."", ""post_time"": [""November"", ""27th,"", ""2024"", ""at"", ""4:54"", ""pm""]}, ""commenter8"": {""username"": ""GoneGator"", ""post"": ""Kenton Smith Says: November 27th, 2024 at 4:24 pm Sorry GoneGator- Mike Evans isn\u2019t gonna carry a team anymore"", ""post_time"": [""November"", ""27th,"", ""2024"", ""at"", ""5:55"", ""pm""]}, ""commenter9"": {""username"": ""Joseph C Simmons"", ""post"": ""Ravens, Chiefs, Niners, Atlanta 1,2, were all very winnable. Only Denver was a blowout loss."", ""post_time"": [""Joseph"", ""C"", ""Simmons""]}, ""commenter10"": {""username"": ""BucsFan81"", ""post"": ""When we lost to Denver the players were still trying to learn the offense and we didn\u2019t have the run game established. With this run game we have now and if we had a healthy Godwin and Evans we could pretty much beat anyone. Hope we get to run it back next year with everyone healthy and some added talent from the draft."", ""post_time"": [""November"", ""27th,"", ""2024"", ""at"", ""7:52"", ""pm""]}, ""commenter11"": {""username"": ""toopanca"", ""post"": ""Does anyone keep stats for receiving yards + yards for defensive penalties drawn?  It seems like the team gains hundreds of yards every season on penalties against defenders trying to cover Evan\u2019s.  If he misses 1,000 yards this year, it seems like the penalty yards attracted should be a significant part of his HOF cred."", ""post_time"": [""November"", ""27th,"", ""2024"", ""at"", ""9:43"", ""pm""]}, ""commenter12"": {""username"": ""Dave Pear"", ""post"": ""I agree with the Joes.  Well said."", ""post_time"": [""November"", ""28th,"", ""2024"", ""at"", ""12:13"", ""am""]}, ""commenter13"": {""username"": ""heyjude"", ""post"": ""It is Mike\u2019s presence that does help make a difference. We were down Mike and Chris, low point for the Bucs. We all felt it too. Now having Mike back pumped up momentum. The team was on fire against the Giants."", ""post_time"": [""November"", ""28th,"", ""2024"", ""at"", ""7:05"", ""am""]}, ""commenter14"": {""username"": ""Bartow Buc"", ""post"": ""ME 13 \u2026.. What a Hoss \u2026.. What a stud \u2026.. Pro Bowler, Hall of Fame Receiver for sure!! "", ""post_time"": [""November"", ""28th,"", ""2024"", ""at"", ""6:27"", ""pm""]}, ""commenter15"": {""username"": ""orlbucfan"", ""post"": ""Broncos. Sure hope their power posse are keeping Payton on a real tight leash about cheating. Don\u2019t they have a winning record?"", ""post_time"": [""November"", ""28th,"", ""2024"", ""at"", ""6:44"", ""pm""]}}"
